{
  "schemaVersion": 1,
  "reviewedAt": "2026-10-11",
  "source": "src/main/resources/api/openapi.yaml",
  "authorizationSource": "security/authorization-policy.json",
  "workflows": [
    {
      "id": "build-and-source-discovery",
      "actors": [
        "ANONYMOUS",
        "MEMBER",
        "TRAINER",
        "SPORT_DIRECTOR",
        "YOUTH_DIRECTOR",
        "GROUNDSKEEPER",
        "TREASURER",
        "ADMIN",
        "INITIAL_PASSWORD"
      ],
      "entryPoints": "Public source-offer and OpenAPI endpoints.",
      "operationIds": [
        "getSourceOffer",
        "getApiDocument"
      ],
      "backgroundEntryPoints": [],
      "stateTransitions": [
        "No product state changes."
      ],
      "alternatePaths": [
        "The source offer reflects the configured fork and the API document describes the running contract."
      ],
      "failurePaths": [
        "An invalid source URL refuses startup; unavailable metadata remains a conspicuous build-identity failure."
      ],
      "productionPaths": [
        "src/main/java/org/courtside/shared/web/SourceOfferController.java",
        "src/main/java/org/courtside/shared/web/ApiDocumentController.java"
      ],
      "evidence": [
        "src/test/java/org/courtside/SourceOfferTest.java#givenNobodyIsLoggedIn_whenAskingWhereTheSourceIs_thenTheAnswerNamesAVersionAndAPlace"
      ]
    },
    {
      "id": "session-and-own-account",
      "actors": [
        "ANONYMOUS",
        "MEMBER",
        "TRAINER",
        "SPORT_DIRECTOR",
        "YOUTH_DIRECTOR",
        "GROUNDSKEEPER",
        "TREASURER",
        "ADMIN",
        "INITIAL_PASSWORD"
      ],
      "entryPoints": "Login, logout, reauthentication, unauthenticated account recovery and own-account endpoints.",
      "operationIds": [
        "getSessionStatus",
        "logIn",
        "logOut",
        "reauthenticate",
        "requestPasswordReset",
        "redeemPasswordReset",
        "requestUsernameReminder",
        "changeInitialPassword",
        "changeOwnPassword",
        "listOwnSessions",
        "endOwnSessions",
        "endOwnSession",
        "changeOwnLocale",
        "listOwnMessageChoices",
        "chooseOwnMessages",
        "listOwnMessageChannels",
        "chooseOwnMessageChannels",
        "listOwnNotifications",
        "markOwnNotificationRead"
      ],
      "backgroundEntryPoints": [
        "AgedSessionSweep#deleteSessionsPastTheirLifetime",
        "BootstrapAdminInitializer#run",
        "CredentialMailer#on(CredentialsRequested)",
        "IdentityCleanupSchedule#deleteExpiredCredentialIssues",
        "IdentityCleanupSchedule#deleteExpiredLoginAttempts",
        "IdentityCleanupSchedule#deleteExpiredResetMailWindows",
        "IdentityCleanupSchedule#deleteExpiredResetTokens",
        "PasswordResetCodeMailer#on(PasswordResetRequested)",
        "SignInFailureLog#on(AbstractAuthenticationFailureEvent)",
        "UsernameReminderMailer#on(UsernameReminderRequested)"
      ],
      "stateTransitions": [
        "Credentials create a server-side session.",
        "Password or security changes revoke earlier authority.",
        "Logout and session termination delete or invalidate sessions.",
        "Locale and message choices update account preferences.",
        "An unauthenticated recovery request by username issues a one-time credential and ends the account's sessions; one by address issues nothing."
      ],
      "alternatePaths": [
        "Initial credentials require a permanent password before ordinary use.",
        "The current session can be ended without a second proof while other sessions require recent authentication.",
        "A shared address holds several accounts, so the address path reminds each of its own name rather than issuing a credential per account."
      ],
      "failurePaths": [
        "Unknown, disabled and wrong-credential logins remain indistinguishable.",
        "Expired proof, CSRF failure, rate limits and invalid password policy refuse without partial account mutation.",
        "Recovery answers 202 for a subject that exists and one that does not, and swallows the per-account issuing limit so no refusal distinguishes them; the caller's own window answers 429."
      ],
      "productionPaths": [
        "src/main/java/org/courtside/identity/internal/AccountController.java",
        "src/main/java/org/courtside/identity/internal/AccountRecoveryController.java",
        "src/main/java/org/courtside/identity/internal/SecurityConfiguration.java",
        "src/main/java/org/courtside/notification/web/MessageChoiceController.java"
      ],
      "evidence": [
        "src/test/java/org/courtside/identity/LoginTest.java#givenFiveDifferentReasonsToRefuse_whenSigningIn_thenTheAnswersCannotBeToldApart",
        "src/test/java/org/courtside/identity/SignOutTest.java#givenASignedInAccount_whenItSignsOut_thenTheSessionIsGone",
        "src/test/java/org/courtside/identity/AccountRecoveryTest.java#givenANameNobodyHolds_whenItIsAsked_thenTheAnswerCannotBeToldFromTheOne"
      ]
    },
    {
      "id": "public-club-and-availability",
      "actors": [
        "ANONYMOUS",
        "MEMBER",
        "TRAINER",
        "SPORT_DIRECTOR",
        "YOUTH_DIRECTOR",
        "GROUNDSKEEPER",
        "TREASURER",
        "ADMIN",
        "INITIAL_PASSWORD"
      ],
      "entryPoints": "Public configuration, courts, opening hours, cards, participant lookup and booking-grid endpoints.",
      "operationIds": [
        "listCourts",
        "listOpeningHours",
        "getBookingGrid",
        "getClubConfig",
        "getClubLogo",
        "getAppIcon",
        "getWebManifest",
        "listBookingCardLegend",
        "listBookableCards",
        "listParticipantCards",
        "searchParticipantMembers"
      ],
      "backgroundEntryPoints": [],
      "stateTransitions": [
        "No product state changes."
      ],
      "alternatePaths": [
        "Uploaded branding replaces the configured URL fallback.",
        "Anonymous and authenticated callers receive the same public availability without private fields."
      ],
      "failurePaths": [
        "Missing uploaded branding returns a typed not-found response.",
        "Participant search and grid bounds reject invalid input without broadening the returned set."
      ],
      "productionPaths": [
        "src/main/java/org/courtside/config/web/ConfigController.java",
        "src/main/java/org/courtside/facility/web/CourtController.java",
        "src/main/java/org/courtside/booking/web/BookingController.java",
        "src/main/java/org/courtside/card/web/CardController.java"
      ],
      "evidence": [
        "src/test/java/org/courtside/card/web/CardControllerTest.java#givenRoleRestrictedAndInactiveCards_whenListingTheLegend_thenEveryActiveCardIsPublic",
        "src/test/java/org/courtside/config/web/ConfigControllerTest.java#whenReadingThePublicConfig_thenItPublishesNothingOnlyABoardShouldSee",
        "src/test/java/org/courtside/config/web/ConfigControllerTest.java#givenNoUploadedLogo_whenReadingIt_thenTheTypedNotFoundProblemIsServed"
      ]
    },
    {
      "id": "booking-participation-and-series",
      "actors": [
        "ANONYMOUS",
        "MEMBER",
        "TRAINER",
        "SPORT_DIRECTOR",
        "YOUTH_DIRECTOR",
        "GROUNDSKEEPER",
        "TREASURER",
        "ADMIN",
        "INITIAL_PASSWORD"
      ],
      "entryPoints": "Booking, participation, managed-appointment and recurring-series endpoints.",
      "operationIds": [
        "listAllocations",
        "createBooking",
        "getBookingEligibility",
        "cancelBooking",
        "listPersonalBookings",
        "listOwnParticipations",
        "removeOwnParticipation",
        "listManagedAppointments",
        "getManagedAppointment",
        "previewSeries",
        "createSeries",
        "cancelSeries",
        "previewSeriesMove",
        "moveSeries",
        "listReservedSlots",
        "listOwnWaitlistEntries",
        "joinWaitlist",
        "leaveWaitlist",
        "acceptWaitlistOffer",
        "publishPartnerInvitation",
        "withdrawPartnerInvitation",
        "listOpenPlaces",
        "acceptPartnerInvitation"
      ],
      "backgroundEntryPoints": [
        "BookingMailer#on(BookingConfirmed)",
        "BookingReminderSchedule#remindWhatIsDue",
        "BookingValidationPreparation#onWebServerInitialized(ServletWebServerInitializedEvent)",
        "CancellationMailer#on(BookingCancelled)",
        "DisplacementMailer#on(BookingDisplaced)",
        "MailOutbox#poll",
        "ParticipationMailer#on(ParticipantRecorded)",
        "ParticipationMailer#on(ParticipantWithdrew)",
        "ParticipationMailer#on(PartnerJoined)",
        "PartnerSearchSweep#removeWhatNobodyCanTake",
        "ReminderMailer#on(BookingReminderDue)",
        "SeriesMailer#on(SeriesCancelled)",
        "SeriesMailer#on(SeriesCreated)",
        "SeriesMailer#on(SeriesMoved)",
        "StartupWarmUp#beforeReadiness(ApplicationReadyEvent)",
        "WaitlistMailer#on(WaitlistOffered)",
        "WaitlistSweep#passOnWhatIsDue"
      ],
      "stateTransitions": [
        "A valid request creates a confirmed booking and court allocations.",
        "Cancellation releases allocations and records its actor.",
        "Participation withdrawal removes only the caller's participant record.",
        "Series creation, move and cancellation change all selected occurrences transactionally.",
        "Joining a waitlist stores one open entry per slot and account; a freed slot is offered to the first eligible entry in the transaction that freed it, and acceptance turns the reservation into a confirmed booking.",
        "A holder publishes or withdraws a partner invitation for an own booking; an eligible member who accepts it joins the booking as a participant under the booking row lock.",